{
  "$schema": "https://json-schema.org/draft/2020-12/schema",
  "title": "Item Definition",
  "type": "object",
  "additionalProperties": false,
  "required": [
    "$schema",
    "id",
    "name",
    "description",
    "price",
    "members",
    "model",
    "weight",
    "canTrade",
    "actions"
  ],
  "properties": {
    "$schema": {"type": "string"},
    "id": {"type": "integer", "minimum": 1},
    "name": {"type": "string", "minLength": 1},
    "description": {"type": "string", "minLength": 1},
    "price": {"type": "integer", "minimum": 0},
    "members": {"type": "boolean"},
    "model": {"type": "string", "minLength": 1},
    "weight": {"type": "integer", "minimum": 0},
    "canTrade": {"type": "boolean"},
    "actions": {
      "type": "array",
      "items": {"type": "string", "minLength": 1},
      "uniqueItems": true
    }
  }
}
