{
    "$schema": "../schema/item.schema.json",
    "id": 2,
    "name": "Bronze Pickaxe",
    "description": "A quickly assembled tool for collecting salvage",
    "price": 2,
    "members": false,
    "model": "bronze_pickaxe",
    "weight": 1000,
    "canTrade": true,
    "actions": ["Wield", "Inspect", "Drop"] 
}
